{
  "intent": "inclination_change_transfer",
  "scenario_name": "InclinationChange",
  "satellite_name": "SatInclinationChange",
  "time_period": {
    "start": "5 Nov 2022 00:00:00.000",
    "end": "8 Nov 2022 00:00:00.000"
  },
  "initial_orbit": {
    "coordinate_type": "Modified Keplerian",
    "epoch": "5 Nov 2022 00:00:00.000 UTCG",
    "sma": {
      "value": 6570000,
      "unit": "m"
    },
    "ecc": 0,
    "inc": {
      "value": 28,
      "unit": "deg"
    },
    "raan": {
      "value": 0,
      "unit": "deg"
    },
    "arg_perigee": {
      "value": 0,
      "unit": "deg"
    },
    "true_anomaly": {
      "value": 0,
      "unit": "deg"
    }
  },
  "targets": {
    "apoapsis_radius": {
      "value": 42160000,
      "unit": "m"
    },
    "final_eccentricity": 0,
    "final_inclination": {
      "value": 0,
      "unit": "deg"
    }
  },
  "mcs": {
    "run_after_generation": true,
    "final_propagate_duration": {
      "value": 129600,
      "unit": "sec"
    }
  }
}
